{
  "contract_id": "ASCREVIEW-TOY-PARTIAL-CONTRACT-0001",
  "status": "incomplete",
  "required_inputs": {
    "draft": {
      "status": "missing",
      "description": "No draft text is supplied in this fixture.",
      "accepted_formats": ["docx", "pdf", "markdown", "plain_text", "structured_sections"],
      "paths_or_ids": [],
      "scope": "Draft text review is blocked.",
      "limitations": "ASCReview can only prepare a review plan and missing-information request."
    },
    "marking_scheme": {
      "status": "missing",
      "description": "No marking scheme, assignment brief, weights, or grade descriptors are supplied.",
      "accepted_formats": ["docx", "pdf", "markdown", "plain_text", "image", "structured_json"],
      "paths_or_ids": [],
      "scope": "Rubric scoring is blocked.",
      "limitations": "No teacher-specific scoring or rubric-failure claims may be generated."
    },
    "figures_assets": {
      "status": "not_applicable",
      "description": "No figure review is requested in this fixture.",
      "accepted_formats": ["png", "jpg", "tiff", "pdf", "pptx", "docx", "xlsx", "csv", "markdown", "plain_text"],
      "paths_or_ids": [],
      "scope": "Figure review is disabled.",
      "limitations": "No visual findings may be generated."
    },
    "source_constraints": {
      "status": "partial",
      "description": "The fixture permits only verified open sources or package corpus metadata.",
      "accepted_formats": ["plain_text", "markdown", "docx", "pdf", "structured_json"],
      "paths_or_ids": ["library/source_policy.md", "library/source_index.seed.json"],
      "scope": "Source-policy planning is allowed; factual adjudication is not.",
      "limitations": "No external factual claim may be treated as settled without task-specific sources."
    },
    "assessment_context": {
      "status": "partial",
      "description": "The fixture context is a generic formative workflow-preparation session.",
      "accepted_formats": ["plain_text", "markdown", "docx", "pdf", "structured_json"],
      "paths_or_ids": ["examples/toy_partial_specialization_pack/README.md"],
      "scope": "Workflow planning and missing-input triage are allowed.",
      "limitations": "Final report export and scoring remain blocked."
    }
  },
  "review_permissions": {
    "can_review_draft_text": false,
    "can_score_against_rubric": false,
    "can_review_figures": false,
    "can_make_domain_factual_claims": false,
    "can_export_final_report": false
  },
  "routing_decisions": [
    {
      "route_id": "TOY-PARTIAL-ROUTE-001",
      "route_type": "review_mode",
      "selected_value": "workflow_preparation_only",
      "applies": true,
      "rationale": "Draft and marking scheme are absent, so only workflow setup and missing-information triage are allowed.",
      "evidence_basis": "user_supplied",
      "confidence": "high",
      "limitations": "No draft findings, scores, or rubric-mapped priorities can be produced."
    },
    {
      "route_id": "TOY-PARTIAL-ROUTE-002",
      "route_type": "output_format",
      "selected_value": "MissingInformationRequest",
      "applies": true,
      "rationale": "Blocked review permissions require explicit missing-input requests.",
      "evidence_basis": "domain_expert_heuristic",
      "confidence": "high",
      "limitations": "The request must not ask for dissertation material unless the user starts real specialization."
    }
  ],
  "severity_taxonomy": [
    {
      "severity_id": "rubric_failure",
      "label": "Rubric failure",
      "definition": "A problem likely to lose marks because it directly conflicts with an explicit marking criterion, required element, or assessment instruction.",
      "allowed_when": "The marking scheme, assignment brief, or teacher feedback explicitly supports the priority.",
      "not_allowed_when": "The issue is only a journal convention, style preference, or domain heuristic."
    },
    {
      "severity_id": "scientific_validity_risk",
      "label": "Scientific validity risk",
      "definition": "A problem that could make the scientific claim, design, analysis, interpretation, or conclusion unreliable.",
      "allowed_when": "The issue concerns evidence strength, design logic, method validity, statistical support, or claim overreach.",
      "not_allowed_when": "The issue is merely incomplete formatting or optional polish."
    },
    {
      "severity_id": "reporting_completeness_risk",
      "label": "Reporting completeness risk",
      "definition": "A missing detail prevents readers from understanding what was done, what was found, or how a claim is supported.",
      "allowed_when": "A required method, result, figure, source, or context detail is absent or hard to trace.",
      "not_allowed_when": "The detail is available elsewhere with a clear cross-reference."
    },
    {
      "severity_id": "reproducibility_risk",
      "label": "Reproducibility risk",
      "definition": "A missing data, code, parameter, accession, version, workflow, or source-data detail limits independent verification or rerun.",
      "allowed_when": "The task depends on reusable data, computational analysis, public repositories, or reproducible methods.",
      "not_allowed_when": "Access restrictions are legitimate and clearly documented."
    },
    {
      "severity_id": "policy_compliance_risk",
      "label": "Policy compliance risk",
      "definition": "A potential conflict with a journal, institutional, funder, reporting, ethics, or data-sharing requirement.",
      "allowed_when": "The relevant policy or guideline is in scope and source-linked.",
      "not_allowed_when": "The policy has not been selected by task type, venue, or study design."
    },
    {
      "severity_id": "draft_stage_todo",
      "label": "Draft-stage TODO",
      "definition": "A known gap that is acceptable at the current draft stage but must be resolved before a later review or submission stage.",
      "allowed_when": "The draft stage is early or formative and the missing item is not required immediately by the rubric.",
      "not_allowed_when": "The issue blocks current scoring, validity, or required deliverables."
    },
    {
      "severity_id": "style_or_clarity_polish",
      "label": "Style or clarity polish",
      "definition": "A wording, flow, formatting, or presentation improvement that does not drive scoring or scientific validity by itself.",
      "allowed_when": "The issue improves readability without being a must-fix requirement.",
      "not_allowed_when": "The unclear wording changes the meaning of a claim or hides a methods/results gap."
    }
  ],
  "missing_information_requests": [
    {
      "request_id": "TOY-PARTIAL-MIR-001",
      "input_key": "draft",
      "question": "Provide draft text or specific sections only when a real review session begins.",
      "blocks": ["draft_text_review", "final_report_export"],
      "fallback_if_unavailable": "Continue workflow/package preparation only."
    },
    {
      "request_id": "TOY-PARTIAL-MIR-002",
      "input_key": "marking_scheme",
      "question": "Provide the marking scheme, assignment brief, section weights, or grade descriptors before scored review.",
      "blocks": ["rubric_scoring"],
      "fallback_if_unavailable": "Proceed only with explicitly permitted non-scored formative review."
    }
  ]
}
